{
  "schema_version": "1.0",
  "client_id": "acme-co",
  "last_updated_at": "2026-07-03T09:00:00Z",
  "last_updated_by": "qa-agent",
  "data": {
    "overall_status": "fail",
    "current_round": 1,
    "rounds": [
      {
        "round": 1, "scope": "full", "tested_at": "2026-07-03T09:00:00Z",
        "findings": [
          {
            "id": "qa-1", "reopened_from_id": null,
            "page": "home", "issue": "Contact form doesn't submit", "severity": "blocker",
            "category": "functional", "screenshot_ref": null,
            "status": "open", "agent_note": null
          }
        ],
        "acceptance_criteria_check": [
          { "criterion": "Contact form delivers to leads@acme.co", "verification_method": "submit test form, confirm email receipt", "verified": false, "note": "form submit is broken" }
        ],
        "round_result": "fail"
      }
    ]
  }
}
